{
  "schema": 1,
  "release": "0.18.0",
  "track": "public-beta",
  "phase": "admission-frozen",
  "observation_sha": "16711130210e4a83d05692fa01c884b5cd92fdad",
  "observed_at_utc": "2026-07-18T10:47:45Z",
  "frozen_swarm_sha": null,
  "queue_snapshot": {
    "query": "gh pr list --state open --limit 100 --json number",
    "query_limit": 100,
    "observed_open_count": 42,
    "receipt_count": 42,
    "observed_numbers": [2647,3320,3434,3477,3489,3550,3743,3761,3880,3884,3895,3901,4001,4009,4015,4116,4123,4152,4157,4158,4160,4161,4213,4219,4221,4222,4223,4224,4227,4228,4231,4248,4342,4374,4446,4449,4450,4452,4471,4479,4503,4505],
    "set_equality": true
  },
  "release_lanes": [
    {"name":"release-truth","issue":"https://github.com/EffortlessMetrics/perl-lsp-swarm/issues/3941","owner":"@steven","status":"active","acceptance":["Record v0.17.0 as shipped public beta and keep DAP preview.","Correct README, installation, status, release history, v0.17.0 frontmatter, and generators that can restore alpha wording.","Record each observed channel as VERIFIED, PARTIAL, or NOT_PROVEN.","Do not stage v0.18 notes, versions, lockfiles, or pending history rows."],"proof":["Distribution-channel observations or explicit NOT_PROVEN.","Repository status generator/check and docs path/link validation."]},
    {"name":"release-workflow","issue":"https://github.com/EffortlessMetrics/perl-lsp-swarm/issues/4145","owner":"@steven","status":"queued","acceptance":["Remove duplicate release-published feedback paths and retain one orchestration authority.","Pin Rust and tooling versions; build and validate every archive.","Generate consolidated checksums and fail-closed SPDX SBOM output.","Define and attest the complete subject set before GitHub Release publication.","Use curated notes as sole release prose.","Use named protected publishing environments and least privilege."],"proof":["Workflow contract tests plus actionlint and zizmor.","No-publish candidate rehearsal proves ordering, artifacts, checksums, SBOM, subjects, notes, and permissions."]},
    {"name":"release-lineage","issue":"https://github.com/EffortlessMetrics/perl-lsp-swarm/issues/3161","owner":"@steven","status":"queued","acceptance":["Decide which perl-lsp-unique tests return to swarm.","Decide whether the swarm DAP dispatcher remains canonical.","Name release-repo-only lineage exclusions.","Account for any product behavior that remains unmirrored.","Promote a complete frozen swarm tree without per-file blending."],"proof":["Disposition receipt links each decision to exact SHAs.","Complete-tree equality proof succeeds outside named exclusions."]},
    {"name":"installed-acceptance","issue":"https://github.com/EffortlessMetrics/perl-lsp-swarm/issues/4346","owner":"@steven","status":"queued","acceptance":["Install packaged perllsp, perl-dap, and VSIX into isolated prefix and VS Code profile roots.","Fail if any workspace binary executes; bind exact SHA and artifact hashes.","Exercise version, doctor, health, initialization, readiness, diagnostics, completion, hover, definition, references, symbols, edit/requery, rename or safe refusal, formatting, stale-index eviction, DAP smoke, and shutdown.","Require false exact, stale exact, unsafe edits, unexplained empty, wrong artifact, unbounded fallback, and protocol crash counts all equal zero."],"proof":["Durable receipt binds exact SHA, artifact hashes, resolved executable paths, journey results, and invariant counts.","Receipt is regenerated after the last product mutation and consumed by the no-publish candidate rehearsal."]}
  ],
  "classification_method": {
    "base_and_ancestry": "Each row records the live head and base ref. Head-to-observation ancestry is NOT_PROVEN unless a row proof says otherwise; excluded work is not promoted on inferred freshness.",
    "work_id": "The controlling_issue is the Work-ID when present. Null is explicit and requires a builder-ready follow-up before revival.",
    "user_outcome": "Paths, relationship, and rationale state the user-facing or control-plane outcome used for disposition.",
    "current_main": "Only the completed correctness band was re-proved on current main. Other product changes are not reproduced and remain excluded unless packaged acceptance exposes a blocker.",
    "proof_strength": "Checks and unresolved-thread counts are exact-head GitHub observations where available; null and unknown values are preserved.",
    "missing_controls": "A deferred PR needs current-main reproduction, exact-head terminal checks, negative controls, and resolved review threads before revival.",
    "release_value": "Admission is limited to honest release truth, mechanics, lineage, installed proof, and one demonstrated product blocker.",
    "regression_risk": "Unadmitted product, parser, performance, refactor, and control-plane mutations can invalidate acceptance and are deferred.",
    "proof_cost": "Deep proof is paid only for admitted lanes; deferred PRs retain their issue and current observation for post-release work.",
    "rollback": "Admission-only changes can be reverted before final freeze; any product mutation after acceptance invalidates the receipt and requires a full rerun."
  },
  "items": [
    {"number":4505,"title":"fix(dap): restore named-sub breakpoint stops (#4489)","url":"https://github.com/EffortlessMetrics/perl-lsp-swarm/pull/4505","head_sha":"0033c430f4448e4cb146047c694dd93ac0e1a6dd","base_ref":"main","is_draft":false,"mergeability":"mergeable","checks":{"failed":0,"pending":20,"basis":"live exact-head snapshot while hosted and review checks were still running"},"unresolved_threads":0,"controlling_issue":"https://github.com/EffortlessMetrics/perl-lsp-swarm/issues/4489","paths":["perl-dap debug adapter","DAP scope and process tests"],"relationship":"Product regression fix opened after admission classification began.","disposition":"post-0.18","rationale":"DAP remains preview and the installed DAP smoke, not an unproven late product mutation, decides whether this becomes a release blocker.","owner":null,"acceptance":[],"proof":[],"follow_up_issue":"https://github.com/EffortlessMetrics/perl-lsp-swarm/issues/4489"},
    {"number":4503,"title":"chore(badges): refresh public endpoints (#8820)","url":"https://github.com/EffortlessMetrics/perl-lsp-swarm/pull/4503","head_sha":"b9917ef821c621b2cde31d523e31499b0b9e56cf","base_ref":"main","is_draft":false,"mergeability":"mergeable","checks":{"failed":0,"pending":1,"basis":"validate-title queued at live exact-head snapshot"},"unresolved_threads":0,"controlling_issue":"https://github.com/EffortlessMetrics/perl-lsp-swarm/issues/8820","paths":["badges/ripr-plus.json"],"relationship":"Replacement badge refresh after #4502 left the queue; public-claim input to release truth.","disposition":"post-0.18","rationale":"A badge refresh is not required to prove or package 0.18.0; release truth must verify the endpoint before changing the claim.","owner":null,"acceptance":[],"proof":[],"follow_up_issue":"https://github.com/EffortlessMetrics/perl-lsp-swarm/issues/8820"},
    {"number":4479,"title":"test(lsp): accept {delta:true} for semanticTokensProvider.full (#4472)","url":"https://github.com/EffortlessMetrics/perl-lsp-swarm/pull/4479","head_sha":"9ee44b4bbf33895ffc089a73fbba41eb1f8f5342","base_ref":"main","is_draft":true,"mergeability":"unknown","checks":{"failed":0,"pending":0,"basis":"live exact-head snapshot"},"unresolved_threads":0,"controlling_issue":"https://github.com/EffortlessMetrics/perl-lsp-swarm/issues/4472","paths":["LSP semantic-token capability contract test"],"relationship":"Standalone backlog test change.","disposition":"post-0.18","rationale":"Draft coverage work is outside the frozen release proof path.","owner":null,"acceptance":[],"proof":[],"follow_up_issue":"https://github.com/EffortlessMetrics/perl-lsp-swarm/issues/4472"},
    {"number":4471,"title":"feat(diagnostics): PL303 cross-file/transitive role-conflict substrate (#2972)","url":"https://github.com/EffortlessMetrics/perl-lsp-swarm/pull/4471","head_sha":"0240d2999987d0a5f08f141fc24e0bbdfb955b62","base_ref":"main","is_draft":false,"mergeability":"unknown","checks":{"failed":2,"pending":0,"basis":"PR Smoke and hosted UB review failed at observation"},"unresolved_threads":2,"controlling_issue":"https://github.com/EffortlessMetrics/perl-lsp-swarm/issues/2972","paths":["PL303 diagnostics","workspace package graph"],"relationship":"Canonical survivor over older draft #4450.","disposition":"post-0.18","rationale":"Cross-file diagnostic expansion is product feature work, not a release blocker.","owner":null,"acceptance":[],"proof":[],"follow_up_issue":"https://github.com/EffortlessMetrics/perl-lsp-swarm/issues/2972"},
    {"number":4452,"title":"chore(backlog-sprint): modernize offsets, DAP assertion, and rustdoc-link fixes (#3922)","url":"https://github.com/EffortlessMetrics/perl-lsp-swarm/pull/4452","head_sha":"000d7bfc081bffe7a0e61410814281b728d75afc","base_ref":"main","is_draft":false,"mergeability":"unknown","checks":{"failed":0,"pending":0,"basis":"live exact-head snapshot"},"unresolved_threads":0,"controlling_issue":"https://github.com/EffortlessMetrics/perl-lsp-swarm/issues/3922","paths":["corpus","DAP","parser","refactoring","semantic tests"],"relationship":"Multi-issue backlog bundle.","disposition":"post-0.18","rationale":"Broad backlog cleanup is explicitly excluded after the correctness band.","owner":null,"acceptance":[],"proof":[],"follow_up_issue":"https://github.com/EffortlessMetrics/perl-lsp-swarm/issues/3922"},